,Unnamed: 0,end_sid,character_name,summary
10,1.0,245.7546495573784,Major,"Major is an old, wise, and highly respected boar on the farm. He is known for his wisdom and benevolence, despite his age and physical changes. Major is the one who had a strange dream that he wished to share with the other animals, leading to a meeting in the barn. He is a visionary, foreseeing a rebellion and a time when animals will be free from human tyranny."
11,,725.2639486721351,Major,"Major is a significant character in Animal Farm, despite his physical absence. He is a visionary, whose speeches and ideas have inspired the animals' rebellion and their ongoing struggle for a better life. His influence is so profound that his absence leaves a leadership void on the farm, which is filled by characters with different intentions and methods. His place of prominence, where he used to deliver his speeches, is now occupied by Napoleon, indicating a shift in power. Major's legacy continues to impact the farm and its inhabitants."
12,,1175.773247786892,Major,"Major is an elderly boar who is greatly esteemed by his fellow animals on the farm. He is a visionary and a catalyst for rebellion, inspiring the animals with his speeches about the oppression of mankind and his dreams of a world where animals are free from human tyranny. Despite his significant influence, he is not involved in the farm's current affairs, indicating that he may no longer be alive."
13,,1673.2825469016486,Major,"Major is an old boar who is known for his ideas of Animalism, which inspire the rebellion on the farm. Although he passes away before he can witness the results of the rebellion, his influence is significant. He is not directly involved with the farm's operations or its interactions with the outside world, unlike Whymper, the farm's broker. Major's character contrasts with Whymper's, who is a small, cunning man primarily interested in the farm for profit and largely unaware of its internal affairs."
14,2.0,245.7546495573784,Moses,"Moses is a tame raven who is a pet of Mr. Jones. He is known for his storytelling and is described as a spy and a tale-bearer. Moses talks of a mysterious place called Sugarcandy Mountain, a paradise for animals after they die. He is not well-liked among the animals due to his lack of work and his tales."
15,,1673.2825469016486,Moses,"Moses is a raven who has returned to Animal Farm after a long absence. He is characterized by his lack of work and his constant talk of Sugarcandy Mountain, a supposed paradise for animals after death. Despite his lack of contribution to the farm's work, he is allowed to stay, suggesting he serves a symbolic role, possibly representing religion. He is the only character who has contact with the outside world through Whymper, a sly-looking solicitor who visits the farm weekly."
16,3.0,245.7546495573784,Bluebell,Bluebell is one of the three dogs on the farm. She is among the first animals to arrive at the meeting called by Major. Her specific personality traits and relationships are not detailed in the text.
17,,1413.5278973442703,Bluebell,"Bluebell is a brave and aggressive dog who plays a significant role in the physical confrontations on the farm, even going as far as nearly tearing off a man's trousers during a battle. She is part of Napoleon's bodyguard, which signifies her loyalty and her crucial position within the farm's power structure. Despite her fierce nature, she, like the other animals, views Whymper with a sense of dread and avoids him as much as possible."
18,,1673.2825469016486,Bluebell,"Bluebell is a dog character in Animal Farm who is known for giving birth to puppies. These puppies are later trained by Napoleon to serve as his personal guard. Although she doesn't play a direct role in the story, her offspring become significant characters. Bluebell's life ends during the course of the story."
